The following are the CPUID leaf function run on the nested VM Lubuntu by passing the input values ecx = exit_reason(number) and eax = 0x4ffffffe: 
************************************************************************************
anupamak@anupama-kvm:~$ cpuid -l 0x4ffffffe -s 0x06
CPU 0:
   0x4ffffffe 0x06: eax=0x00000000 ebx=0x00000000 ecx=0x00000000 edx=0xffffffff
CPU 1:
   0x4ffffffe 0x06: eax=0x00000000 ebx=0x00000000 ecx=0x00000000 edx=0xffffffff
anupamak@anupama-kvm:~$ cpuid -l 0x4ffffffe -s 0x07
CPU 0:
   0x4ffffffe 0x07: eax=0x000023f3 ebx=0xffff9d40 ecx=0x00000007 edx=0xffff9d40
CPU 1:
   0x4ffffffe 0x07: eax=0x000023f3 ebx=0xffff9d40 ecx=0x00000007 edx=0xffff9d40
anupamak@anupama-kvm:~$ cpuid -l 0x4ffffffe -s 0x08
CPU 0:
   0x4ffffffe 0x08: eax=0x00000000 ebx=0xffff9d40 ecx=0x00000008 edx=0xffff9d40
CPU 1:
   0x4ffffffe 0x08: eax=0x00000000 ebx=0xffff9d40 ecx=0x00000008 edx=0xffff9d40
anupamak@anupama-kvm:~$ cpuid -l 0x4ffffffe -s 0x09
CPU 0:
   0x4ffffffe 0x09: eax=0x00000000 ebx=0xffff9d40 ecx=0x00000009 edx=0xffff9d40
CPU 1:
   0x4ffffffe 0x09: eax=0x00000000 ebx=0xffff9d40 ecx=0x00000009 edx=0xffff9d40
anupamak@anupama-kvm:~$ cpuid -l 0x4ffffffe -s 0x010
CPU 0:
   0x4ffffffe 0x10: eax=0x00000000 ebx=0x00000000 ecx=0x00000000 edx=0x00000000
CPU 1:
   0x4ffffffe 0x10: eax=0x00000000 ebx=0x00000000 ecx=0x00000000 edx=0x00000000
anupamak@anupama-kvm:~$ cpuid -l 0x4ffffffe -s 0x00a
CPU 0:
   0x4ffffffe 0x0a: eax=0x0003ffb4 ebx=0xffff9d40 ecx=0x0000000a edx=0xffff9d40
CPU 1:
   0x4ffffffe 0x0a: eax=0x0003ffb5 ebx=0xffff9d40 ecx=0x0000000a edx=0xffff9d40
anupamak@anupama-kvm:~$ cpuid -l 0x4ffffffe -s 0x00b
CPU 0:
   0x4ffffffe 0x0b: eax=0x00000000 ebx=0x00000000 ecx=0x00000000 edx=0xffffffff
CPU 1:
   0x4ffffffe 0x0b: eax=0x00000000 ebx=0x00000000 ecx=0x00000000 edx=0xffffffff
anupamak@anupama-kvm:~$ cpuid -l 0x4ffffffe -s 0x00c
CPU 0:
   0x4ffffffe 0x0c: eax=0x0000b38c ebx=0xffff9d40 ecx=0x0000000c edx=0xffff9d40
CPU 1:
   0x4ffffffe 0x0c: eax=0x0000b38d ebx=0xffff9d40 ecx=0x0000000c edx=0xffff9d40
anupamak@anupama-kvm:~$ cpuid -l 0x4ffffffe -s 0x00d
CPU 0:
   0x4ffffffe 0x0d: eax=0x00000000 ebx=0xffff9d40 ecx=0x0000000d edx=0xffff9d40
CPU 1:
   0x4ffffffe 0x0d: eax=0x00000000 ebx=0xffff9d40 ecx=0x0000000d edx=0xffff9d40
anupamak@anupama-kvm:~$ cpuid -l 0x4ffffffe -s 0x00e
CPU 0:
   0x4ffffffe 0x0e: eax=0x00000000 ebx=0xffff9d40 ecx=0x0000000e edx=0xffff9d40
CPU 1:
   0x4ffffffe 0x0e: eax=0x00000000 ebx=0xffff9d40 ecx=0x0000000e edx=0xffff9d40
anupamak@anupama-kvm:~$ cpuid -l 0x4ffffffe -s 0x00f
CPU 0:
   0x4ffffffe 0x0f: eax=0x00000000 ebx=0xffff9d40 ecx=0x0000000f edx=0xffff9d40
CPU 1:
   0x4ffffffe 0x0f: eax=0x00000000 ebx=0xffff9d40 ecx=0x0000000f edx=0xffff9d40
anupamak@anupama-kvm:~$ cpuid -l 0x4ffffffe -s 0x010
CPU 0:
   0x4ffffffe 0x10: eax=0x00000000 ebx=0x00000000 ecx=0x00000000 edx=0x00000000
CPU 1:
   0x4ffffffe 0x10: eax=0x00000000 ebx=0x00000000 ecx=0x00000000 edx=0x00000000
anupamak@anupama-kvm:~$ cpuid -l 0x4ffffffe -s 0x011
CPU 0:
   0x4ffffffe 0x11: eax=0x00000000 ebx=0x00000000 ecx=0x00000000 edx=0xffffffff
CPU 1:
   0x4ffffffe 0x11: eax=0x00000000 ebx=0x00000000 ecx=0x00000000 edx=0xffffffff
anupamak@anupama-kvm:~$ cpuid -l 0x4ffffffe -s 0x12
CPU 0:
   0x4ffffffe 0x12: eax=0x00000000 ebx=0xffff9d40 ecx=0x00000012 edx=0xffff9d40
CPU 1:
   0x4ffffffe 0x12: eax=0x00000000 ebx=0xffff9d40 ecx=0x00000012 edx=0xffff9d40
anupamak@anupama-kvm:~$ cpuid -l 0x4ffffffe -s 0x13
CPU 0:
   0x4ffffffe 0x13: eax=0x00000000 ebx=0xffff9d40 ecx=0x00000013 edx=0xffff9d40
CPU 1:
   0x4ffffffe 0x13: eax=0x00000000 ebx=0xffff9d40 ecx=0x00000013 edx=0xffff9d40
anupamak@anupama-kvm:~$ cpuid -l 0x4ffffffe -s 0x14
CPU 0:
   0x4ffffffe 0x14: eax=0x00000000 ebx=0xffff9d40 ecx=0x00000014 edx=0xffff9d40
CPU 1:
   0x4ffffffe 0x14: eax=0x00000000 ebx=0xffff9d40 ecx=0x00000014 edx=0xffff9d40
anupamak@anupama-kvm:~$ cpuid -l 0x4ffffffe -s 0x15
CPU 0:
   0x4ffffffe 0x15: eax=0x00000000 ebx=0xffff9d40 ecx=0x00000015 edx=0xffff9d40
CPU 1:
   0x4ffffffe 0x15: eax=0x00000000 ebx=0xffff9d40 ecx=0x00000015 edx=0xffff9d40
anupamak@anupama-kvm:~$ cpuid -l 0x4ffffffe -s 0x16
CPU 0:
   0x4ffffffe 0x16: eax=0x00000000 ebx=0xffff9d40 ecx=0x00000016 edx=0xffff9d40
CPU 1:
   0x4ffffffe 0x16: eax=0x00000000 ebx=0xffff9d40 ecx=0x00000016 edx=0xffff9d40
anupamak@anupama-kvm:~$ cpuid -l 0x4ffffffe -s 0x17
CPU 0:
   0x4ffffffe 0x17: eax=0x00000000 ebx=0xffff9d40 ecx=0x00000017 edx=0xffff9d40
CPU 1:
   0x4ffffffe 0x17: eax=0x00000000 ebx=0xffff9d40 ecx=0x00000017 edx=0xffff9d40
anupamak@anupama-kvm:~$ cpuid -l 0x4ffffffe -s 0x18
CPU 0:
   0x4ffffffe 0x18: eax=0x00000000 ebx=0xffff9d40 ecx=0x00000018 edx=0xffff9d40
CPU 1:
   0x4ffffffe 0x18: eax=0x00000000 ebx=0xffff9d40 ecx=0x00000018 edx=0xffff9d40
anupamak@anupama-kvm:~$ cpuid -l 0x4ffffffe -s 0x19
CPU 0:
   0x4ffffffe 0x19: eax=0x00000000 ebx=0xffff9d40 ecx=0x00000019 edx=0xffff9d40
CPU 1:
   0x4ffffffe 0x19: eax=0x00000000 ebx=0xffff9d40 ecx=0x00000019 edx=0xffff9d40
anupamak@anupama-kvm:~$ cpuid -l 0x4ffffffe -s 0x2a
CPU 0:
   0x4ffffffe 0x2a: eax=0x00000000 ebx=0x00000000 ecx=0x00000000 edx=0xffffffff
CPU 1:
   0x4ffffffe 0x2a: eax=0x00000000 ebx=0x00000000 ecx=0x00000000 edx=0xffffffff
anupamak@anupama-kvm:~$ cpuid -l 0x4ffffffe -s 0x2b
CPU 0:
   0x4ffffffe 0x2b: eax=0x00000000 ebx=0xffff9d40 ecx=0x0000002b edx=0xffff9d40
CPU 1:
   0x4ffffffe 0x2b: eax=0x00000000 ebx=0xffff9d40 ecx=0x0000002b edx=0xffff9d40
anupamak@anupama-kvm:~$ cpuid -l 0x4ffffffe -s 0x2c
CPU 0:
   0x4ffffffe 0x2c: eax=0x00000000 ebx=0xffff9d40 ecx=0x0000002c edx=0xffff9d40
CPU 1:
   0x4ffffffe 0x2c: eax=0x00000000 ebx=0xffff9d40 ecx=0x0000002c edx=0xffff9d40
anupamak@anupama-kvm:~$ cpuid -l 0x4ffffffe -s 0x2d
CPU 0:
   0x4ffffffe 0x2d: eax=0x00000000 ebx=0xffff9d40 ecx=0x0000002d edx=0xffff9d40
CPU 1:
   0x4ffffffe 0x2d: eax=0x00000000 ebx=0xffff9d40 ecx=0x0000002d edx=0xffff9d40
anupamak@anupama-kvm:~$ cpuid -l 0x4ffffffe -s 0x2e
CPU 0:
   0x4ffffffe 0x2e: eax=0x0000000c ebx=0xffff9d40 ecx=0x0000002e edx=0xffff9d40
CPU 1:
   0x4ffffffe 0x2e: eax=0x0000000c ebx=0xffff9d40 ecx=0x0000002e edx=0xffff9d40
anupamak@anupama-kvm:~$ cpuid -l 0x4ffffffe -s 0x2f
CPU 0:
   0x4ffffffe 0x2f: eax=0x00000004 ebx=0xffff9d40 ecx=0x0000002f edx=0xffff9d40
CPU 1:
   0x4ffffffe 0x2f: eax=0x00000004 ebx=0xffff9d40 ecx=0x0000002f edx=0xffff9d40
anupamak@anupama-kvm:~$ cpuid -l 0x4ffffffe -s 0x048
CPU 0:
   0x4ffffffe 0x48: eax=0x00000000 ebx=0x00000000 ecx=0x00000000 edx=0xffffffff
CPU 1:
   0x4ffffffe 0x48: eax=0x00000000 ebx=0x00000000 ecx=0x00000000 edx=0xffffffff
anupamak@anupama-kvm:~$ cpuid -l 0x4ffffffe -s 0x025
CPU 0:
   0x4ffffffe 0x25: eax=0x00000000 ebx=0xffff9d40 ecx=0x00000025 edx=0xffff9d40
CPU 1:
   0x4ffffffe 0x25: eax=0x00000000 ebx=0xffff9d40 ecx=0x00000025 edx=0xffff9d40
anupamak@anupama-kvm:~$ cpuid -l 0x4ffffffe -s 0x027
CPU 0:
   0x4ffffffe 0x27: eax=0x00000000 ebx=0xffff9d40 ecx=0x00000027 edx=0xffff9d40
CPU 1:
   0x4ffffffe 0x27: eax=0x00000000 ebx=0xffff9d40 ecx=0x00000027 edx=0xffff9d40
anupamak@anupama-kvm:~$ cpuid -l 0x4ffffffe -s 0x028
CPU 0:
   0x4ffffffe 0x28: eax=0x00002c5a ebx=0xffff9d40 ecx=0x00000028 edx=0xffff9d40
CPU 1:
   0x4ffffffe 0x28: eax=0x00002c5a ebx=0xffff9d40 ecx=0x00000028 edx=0xffff9d40
anupamak@anupama-kvm:~$ cpuid -l 0x4ffffffe -s 0x30
CPU 0:
   0x4ffffffe 0x30: eax=0x00047f1c ebx=0xffff9d40 ecx=0x00000030 edx=0xffff9d40
CPU 1:
   0x4ffffffe 0x30: eax=0x00047f1c ebx=0xffff9d40 ecx=0x00000030 edx=0xffff9d40
anupamak@anupama-kvm:~$ cpuid -l 0x4ffffffe -s 0x31
CPU 0:
   0x4ffffffe 0x31: eax=0x000110ee ebx=0xffff9d40 ecx=0x00000031 edx=0xffff9d40
CPU 1:
   0x4ffffffe 0x31: eax=0x000110ee ebx=0xffff9d40 ecx=0x00000031 edx=0xffff9d40
anupamak@anupama-kvm:~$ cpuid -l 0x4ffffffe -s 0x1a
CPU 0:
   0x4ffffffe 0x1a: eax=0x00000000 ebx=0xffff9d40 ecx=0x0000001a edx=0xffff9d40
CPU 1:
   0x4ffffffe 0x1a: eax=0x00000000 ebx=0xffff9d40 ecx=0x0000001a edx=0xffff9d40
anupamak@anupama-kvm:~$ cpuid -l 0x4ffffffe -s 0x1b
CPU 0:
   0x4ffffffe 0x1b: eax=0x00000000 ebx=0xffff9d40 ecx=0x0000001b edx=0xffff9d40
CPU 1:
   0x4ffffffe 0x1b: eax=0x00000000 ebx=0xffff9d40 ecx=0x0000001b edx=0xffff9d40
anupamak@anupama-kvm:~$ cpuid -l 0x4ffffffe -s 0x1c
CPU 0:
   0x4ffffffe 0x1c: eax=0x0000d010 ebx=0xffff9d40 ecx=0x0000001c edx=0xffff9d40
CPU 1:
   0x4ffffffe 0x1c: eax=0x0000d010 ebx=0xffff9d40 ecx=0x0000001c edx=0xffff9d40
anupamak@anupama-kvm:~$ cpuid -l 0x4ffffffe -s 0x1d
CPU 0:
   0x4ffffffe 0x1d: eax=0x00000004 ebx=0xffff9d40 ecx=0x0000001d edx=0xffff9d40
CPU 1:
   0x4ffffffe 0x1d: eax=0x00000004 ebx=0xffff9d40 ecx=0x0000001d edx=0xffff9d40
anupamak@anupama-kvm:~$ cpuid -l 0x4ffffffe -s 0x1e
CPU 0:
   0x4ffffffe 0x1e: eax=0x0006828d ebx=0xffff9d40 ecx=0x0000001e edx=0xffff9d40
CPU 1:
   0x4ffffffe 0x1e: eax=0x0006828d ebx=0xffff9d40 ecx=0x0000001e edx=0xffff9d40
anupamak@anupama-kvm:~$ cpuid -l 0x4ffffffe -s 0x1f
CPU 0:
   0x4ffffffe 0x1f: eax=0x00001e75 ebx=0xffff9d40 ecx=0x0000001f edx=0xffff9d40
CPU 1:
   0x4ffffffe 0x1f: eax=0x00001e75 ebx=0xffff9d40 ecx=0x0000001f edx=0xffff9d40
************************************************************************************
The output is read on the host machine captured in "hostVM_read.me" file.
